<?xml version="1.0"?>
<xs:schema attributeFormDefault="unqualified" elementFormDefault="qualified" xmlns:xs="http://www.w3.org/2001/XMLSchema">
    <xs:element name="customers" type="customersType"/>
    <xs:complexType name="customerType">
        <xs:sequence>
            <xs:element type="xs:string" name="name"/>
            <xs:element type="xs:string" name="email"/>
            <xs:element type="xs:string" name="address"/>
        </xs:sequence>
        <xs:attribute type="xs:integer" name="customer_id"/>
    </xs:complexType>
    <xs:complexType name="customersType">
        <xs:sequence>
            <xs:element type="customerType" name="customer" maxOccurs="unbounded" minOccurs="0"/>
        </xs:sequence>
    </xs:complexType>
</xs:schema>